ID,Name,Type,Website,Purpose,Meeting Day,Meeting Location
2307,Musicians' Club @ SDSU (MC@SDSU),Recreational,https://musiciansclub.com/,"The purpose of the Musicians' Club @ SDSU is to provide a network for musicians to communicate, promote socialization and growth in a creative environment, and allow musicians of all skill levels the opportunity to perform in front of live crowds.",Thursdays 7PM,Park Boulevard
2308,Interdisciplinary Studies Student Association (ISSA),Academic Major Related,,The purpose of the Interdisciplinary Studies Student Association (ISSA) is to support students within the IS3D major or those exploring the major. Create a community where students understand the connection of their three disciplines and how they relate to their future career goals.,"Tuesdays, 4:30-5:30 PM","Visionary Suite, Student Union"
2309,Aztec Pickleball Association,Recreational,,To get students active and involved in the fastest growing sport in America. To allow the opportunity for students to get instructing positions at local sports clubs that offer competitive pay.,,
2310,Tabletop Gaming Club,Recreational,https://discord.gg/PSRm2MSV8j,"TTGC works to create a fun environment where we can play board games and make friends.  Discord Invite Link: https://discord.gg/PSRm2MSV8j Instagram: ttgc.sdsu",Tuesday 5:30,
2315,Student Veteran Organization,Cultural,http://www.sdsusvo.org/,Create a space for the Veteran and Military-Connected community to grow together.,"Every other Wednesday, at 12:00",Joan and Art Barron Veteran Center
2320,Hispanic Serving Institution Student Advisory Board (HSI SAB),Cultural,https://sacd.sdsu.edu/diversity-initiatives/hsi-affairs,"The HSI Student Advisory Board is a forum for the consideration, assessment and sharing of the quality of the student experience as it relates to SDSU’s status as a Hispanic Serving Institution.  This includes the student perspective on the implementation of policies and procedures, curriculum, climate, scholarship, representation, student success, and awareness of SDSU’s status as a Hispanic Serving Institution. Activities can include sharing student experiences, posing questions for considerations, making suggestions for change, and generally working with the committee and chair to advance the HSI mission from a student perspective.","Bi-weekly - Fridays at 12pm, starting on 9/6/24",Virtually or at the HSI SAB Office on-campus
2332,Air Force ROTC Honor Guard,Academic Major Related,,To maintain and employ a ceremonial capability to represent SDSU and the Air Force at public and official ceremonies.,,
2337,Asian Business Association at SDSU,Academic Major Related,,"The purposes of this organization are to create a community where the motivated, business-minded members of the American Pacific Islander Desi American (APIDA) community can grow and connect with one another. By doing so, we aim to empower APIDA Members to proudly identify with the Business Community. We are devoted to supporting our members in both their educational and professional pursuits by providing opportunities for them to build their networking and career readiness skills.",,
2342,Save Soil SDSU,Academic Major Related,https://savesoilsdsu.wixsite.com/save-soil-sdsu,"The purpose of this organization is to raise awareness about soil health and the messages of Save Soil—the global movement—among students at SDSU and the surrounding San Diego community. 	 As 52% of the world's agricultural soil is already degraded, Save Soil--the global movement--aims to raise the support of 4 billion people (60% of the world’s electorate) to drive policies in democratic nations, including the U.S., towards revitalizing soil health by increasing the organic content in soil to a minimum of 3-6%.",Biweekly Tuesday (starting 08/27) | 3:30 - 4:30 PM,Aztlan Suite (2nd Floor of Student Union)
2348,Beta Theta Pi Fraternity,Social Fraternity,http://www.beta.org,To develop Men of Principle for a principled life.,"Sunday, 5pm",Pride Suite
2353,Adapted Sports Physical Therapy,Academic Major Related,,"ASPT is committed to service learning by providing diverse educational opportunities rooted in community engagement, mentorship, and experiential learning. Our purpose is to enable future physical therapists to develop clinical reasoning and communication skills with an interdisciplinary approach, and support the adaptive athlete in their athletic performance and well-being.",Thursday 4:15-5:30AM,PG 241
2355,Student Nurses Association - Imperial Valley (SNA-IV),Imperial Valley Campus,https://www.nsna.org,"The purposes of SNA-SDSUIV are: To assume responsibility for contributing to nursing education in order to provide for the highest quality of healthcare. To provide programs representative of fundamental and current professional interest and concerns. To aid in the development of the whole person, their professional role, and their responsibility for the health care of people in all walks of life.",Thursday's Bi Weekly (2x per month) at 1pm,SDSU-IV Brawley Campus
2356,Film Society SDSU,Academic Major Related,,"The purpose of film society is to help new TFM production pre-majors get to meet one another, work together to make films and seek advice about applying to the major.",Tuesdays 5 to 6 PM,Legacy Suite
2357,Art History Club,Academic Major Related,,"The purposes of this organization are to educate members on the history of art, create an inclusive environment where students may learn about, discuss, and appreciate the history of art, and to encourage engagement with the arts through events, trips, discussions, etc.",,
2358,Business Careers in Entertainment Club,Academic Major Related,https://bcecsdsu.com,"The purposes of this organization are to provide internships, job opportunities, hands-on experience, and career information to undergraduate students interested in the business end of the entertainment industry.",Monday 7:30pm,Visionary Suite
2380,Association of Anthropology Students,Academic Major Related,https://sdsuaas.weebly.com/,"The purpose of this organization is to facilitate a unified undergraduate student voice for the department of anthropology, and create a sense of community",biweekly- Fridays 5:00-6:00pm,Metzli Suite Aztec Union
2381,Society of American Military Engineers Student Chapter,Academic Major Related,https://www.same.org/,"To connect, integrate, promote, and support SDSU Undergrads to, and with, Military Engineering Industry by providing industry mentoring, internships, scholarships, and building relationships to enhance future career opportunities.",,
2388,Feminist Outreach Coalition,Cultural,,"The purposes of this organization is to bring greater awareness to the issues impacting women and other people of marginalized genders and identities. The Feminist Outreach Coalition hopes to  make our voices heard as leaders in feminism and the discipline Women, Gender, Sexuality Studies. We will also organize events for feminist community outreach and education.",Wednesday from 2-3 pm,Arts & Letters 330
2391,Surfrider Club at SDSU,Recreational,http://surfrider.org,"Surfrider is dedicated to protecting and enjoying the world’s oceans, waves, and beaches for all people through a powerful activist network. At the center of every action we take is our mission, our grassroots structure, and our local perspectives. We aim for positive impact and measurable results on behalf of the communities that we serve.",Tuesday 4pm-5pm,Student Union - Visionary Suite
2392,Positivity Club,Service & Support,http://none,"Our organization's goal is ""to be the reason someone smiles today"". We practice random acts of kindness throughout campus and make improving student's mental health a priority. Our overall purpose is to be an outlet for students to come to and to overall make the world a happier place:)",TBD,Student Life and Leadership Center
2394,Women in Criminal Justice (WCJ),Academic Major Related,,"We aim to empower and inspire women by offering opportunities and support in pursuing a career in Criminal Justice. We hope that through this program, not only will there be an increase in awareness of women’s potential but also that women will be able to recognize their own.","Tuesday, 3:30-4:30",Student Union
2399,Space Club,Academic Major Related,,"The Space Club focuses on advancing space-related systems and technologies through hands-on engineering projects and research. We provide members with opportunities for both professional growth and casual engagement by working on practical engineering challenges, participating in space and technology research, and gaining exposure to the space industry.  Throughout the semester, members will engage in engineering projects, take field trips to visit leading space-related companies, and explore the latest advancements in the field. The club also fosters a welcoming and supportive community, with regular events that encourage networking and collaboration among individuals passionate about space exploration.  The Space Club is committed to staying informed about the latest developments in space technology and encouraging creativity in applying new knowledge to our projects.",,
2403,Aztec Electric Racing,Academic Major Related,http://aztecelectricracing.com/,"To apply classroom knowledge to building a formula electric race car, while gaining hands on experience and teaching others.",,
2413,Graduate Social Work Association,Academic Major Related,,"The Graduate Social Work Association (GSWA) exists to support students as they navigate their time in the School of Social Work at San Diego State University. GSWA seeks to provide opportunities for students to connect with one another and with faculty. Additionally, we hope to support students’ academic and professional growth, development, and success, and advocate for students to the administration.",Mondays @ 7:00 pm,"Hybrid; In-person: TBA, Zoom: 81498780022"
2421,Stitches @ SDSU,Recreational,,"To meet with like-minded creatives to crochet, knit, and craft.",tbd,
2422,Sikh Student Association,Religious Based,,"The purpose of SSA is to unite Sikhs from across the campus of SDSU with the teachings of our faith and culture, educating not just ourselves, but anyone who would be interested.",TBD,TBD
2423,Political Science Graduate Student Association,Academic Major Related,,"Foster a community of likeminded individuals who share a passion for understanding the political issues impacting our world today. The organization may host their own public discussions in order to encourage a lively exchange of ideas between both the student members and other potential guests. On some occasions, the PSGSA aspires to help by co-hosting political lectures, debates, book promotions and guest speakers. On the recreational side, the PSGSA wants to host special events bring graduates in the Political Science Department together through entertainment and catering. To promote further outreach of the PSGSA, the association plans on coordinating with other student and activist organizations belonging to politically adjacent and complementary fields, particularly organizations and institutions associated with the College of Arts and Letters. Lastly, the PSGSA hopes to find ways to promote community service across the city of San Diego.",,
2424,OUTreach,Academic Major Related,http://www.linktr.ee/OUTreachAtSDSU.com,"OUTreach is comprised of students and individuals who understand the importance of Social Work's role in creating a positive impact in the world, as well as individuals who want to learn more about the many ways social work influences systems of inequality, specifically those impacting the 2SLGBTQ+ community. The purpose of OUTreach is to advance the interests of social work students and promote student participation and involvement by organizing social, cultural, and academic activities and/or programs within the 2SLGBTQ+ community at SDSU and in San Diego. OUTreach aims to take a progressive approach to advance the education and activism of everyone who takes part in the organization. At the foundation of OUTreach, we are caring individuals who aim to better understand and positively affect the world we live in through advocating and activism for the 2SLGBTQ+ community. OUTreach commemorates the contributions 2SLGBTQ+ people have made to the social work discipline and to the world at large. By honoring 2SLGBTQ+ culture, resilience, and social welfare contributions, OUTreach assists the School of Social Work in recognizing the presence and value of diversity.",every 3rd friday,contact for location
2427,Splice: The Journal of Undergraduate Scholarship at SDSU College of Arts and Letters,Academic Major Related,,To formally recognize and open up more official campus-related opportunities for the students who have instigated and are running the undergraduate scholarship journal Splice.,Thursdays once a month -See social media for specs,Visionary Suite
2429,California Music Educators Association at SDSU,Academic Major Related,https://nafme.org/,"The California Music Educators Association (CMEA) at SDSU is an organization that supports music education majors and music majors who are interested in teaching music in the future.  CMEA provides professional development, networking, and collaborative opportunities that will enhance the experience of future music educators.",Friday at 12:00,M120
2439,Leadership Club of SDSU,Leadership,,"Leadership Club of SDSU holds in high regard diversity, inclusiveness, and ethics, always empowering each other toward excellence as we enhance personal growth that helps prepare each student for the work world. We grow best through leading with a servant’s heart and a commitment to developing a broader network of members who share this desire for personal development. Our commitment to the process of Relational Leadership will support and inspire members to become effective leaders through practice and initiate real change as they get involved within the context of service. This will be achieved through creating and supporting initiatives serving both the SDSU campus community as well as the surrounding communities, such as through working with foster youth through Promises2Kids. In turn, members will be able to support their community and practice leadership models that will be discussed and practiced while creating valuable connections and life skills to enable a higher level of job readiness.",,Aztlan Suite in Student Union Building
2440,UNBND at SDSU,Service & Support,https://www.unbndglobal.org,The purpose of this organization is to work to abolish human trafficking and advocate for victims of human trafficking while  educating students about the topics of human trafficking. UNBND is dedicated to the freedom and empowerment of Human Trafficking survivors as this is modern-day slavery.,,
2446,CyberRisk Organization (CybOrg) at SDSU,Academic Major Related,http://sdsucyb.org,"CybOrg is dedicated to advancing cybersecurity proficiency by facilitating hands-on workshops led by industry professionals, fostering networking opportunities with companies and recruiters, and developing skills in risk identification and mitigation. Our focus on achieving professional certifications ensures members are well-prepared to contribute effectively to the cybersecurity landscape.",Wednesday @ 12:30,
2451,Aztec Barbell Club,Recreational,http://linktr.ee/aztecbarbell,To provide a sense of community for strength sport athletes at SDSU in addition to serving as an official club to allow SDSU Powerlifters to compete at the collegiate level.,TBD,TBD
2453,National Association of Hispanic Journalists at SDSU,Academic Major Related,,"Open to all students, regardless of identity, and adheres to the same mission statement and goals as NAHJ: ¿¿organize and provide support for Hispanic Journalists. Encourage and support the study and practices of journalism and communications by Hispanics. ¿¿Promote accurate and fair treatment of Hispanics by the news media. Further employment opportunities and career development for Hispanics in the news media. Foster a greater understanding of the unique cultural identity, interests, and concerns of Hispanic Journalists.",,
2460,End Overdose SDSU,Service & Support,http://endoverdose.net,"End Overdose is a non-profit organization working to end drug-related overdose deaths through education, medical intervention, and public awareness. We will work to make resources that prevent overdose-related deaths accessible to everyone on our campus.",,
2462,AAPI Pre-Law Society,Academic Major Related,,"Shaping the future of law with AAPI representation and inclusion. Hosting biweekly speakers who are AAPI individuals in the law field. Affiliated with the APIDA Center, with the Associate Director as our advisor. Sharing advice and help for law school applications, LSAT Prep, and hosting workshops for developing professional profiles and LinkedIn profiles.","Thursdays, 3:30-5:30PM",APIDA Center
2463,eLeet Coders Club,Academic Major Related,,"This organization's purpose is to prepare students for tech job interviews by having them practice Leet Code problems, network, and listen to advice from industry guest speakers.",Thursdays 8:30 PM-9:30 PM,PS130
2470,Premier Muay Thai Club,Recreational,,"My purpose is to create a vibrant and inclusive community centered around the art of Muay Thai, fostering an environment where individuals can learn, grow, and connect both physically and mentally. Our club is dedicated to promoting the benefits of martial arts, fitness, and camaraderie, offering a unique space on campus where members can embark on a journey of self-improvement and build lasting relationships.",,
2471,Campus Curlz,Cultural,https://medium.com/@arnault-memar/semen-retention-as-a-means-of-challenging-the-modern-masculinity-f,To provide a safe space and unity to celebrate all hair from all cultures specifically people of color.,Bi-weekly,The union
2476,Christians At SDSU,Religious Based,,Bringing forth an opportunity for SDSU students to immerse themselves in the christian community. Weekly bible readings and club events and activities with other sdsu students!,mondays,
2481,Psychedelic Club,Recreational,,"1. Education and Awareness: To provide a platform for students and faculty to learn about psychedelics, their history, cultural significance, potential benefits and risks, and their role in mental health treatment and personal well-being. 2. Responsible Discourse: To foster open and informed discussions about psychedelics, allowing members to share their perspectives, experiences, and knowledge in a respectful and nonjudgmental environment. 3. Research and Exploration: To explore the scientific and therapeutic potential of psychedelics by reviewing existing research and inviting experts to share their findings. 4. Harm Reduction: To promote responsible and safe use of psychedelics by sharing harm reduction strategies and resources to minimize potential risks associated with use. 5. Cultural and Historical Context: To examine the historical, cultural, and societal aspects of psychedelics, including their use in various indigenous traditions and ceremonial contexts. 6. Community Building: To create a supportive and inclusive community of like-minded individuals interested in exploring the multifaceted aspects of psychedelics. 7. Guest Speakers and Workshops: To invite experts, researchers, and practitioners to provide lectures, workshops, and presentations to expand members' knowledge. 8. Outreach and Collaboration: To collaborate with other student organizations, academic departments, and community organizations interested in similar topics.",,
2482,Phi Kappa Tau Fraternity,Social Fraternity,https://www.instagram.com/sdsuphitau/,"We, the men of San Diego State University, in order to develop a lasting legacy of distinction, to instill the fundamentals of brotherhood, scholarship, and character, to promote democratic ethical leadership in the community, to maintain the ideals passed down by the founding fathers, to encourage philanthropic venture, service to the community, and diversity, and to strengthen the bond and pride in our Alma Mater, do hereby establish these bylaws for the Beta Nu chapter of Phi Kappa Tau Fraternity.",,
2491,Spanish Language Society,Academic Major Related,,"The purposes of this organization are to create a welcoming environment where individuals of all backgrounds come together to enhance their Spanish speaking and comprehension abilities, and prepare members for success in the workforce and beyond.",Mondays 5:30pm-6:30pm,Mata'yuum
2492,XCENTRIC!SD Dance Team,Recreational,,"The purpose of this organization is to serve as a passionate K-Pop dance collective united by our love for music, dance, and the pursuit of excellence. We prioritize motivation, excellence, and fostering an environment free from discrimination and hate. We stand firm against any form of hate, striving to create a space where every member is valued and respected regardless of their background. Our mission is to uplift, inspire, and shine through the world of K-pop dance.",,
2493,Aztec Robotics,Academic Major Related,,"The goal of our organization is to create a dynamic learning environment at the intersection of hardware and software, fostering hands-on experiences in robotics. Through targeted workshops, we aim to cultivate knowledge that is essential in the engineering field. Our commitment is to deliver a measurable impact by providing workshops in which we design and build robots for collegiate competitions while reaching a diverse student body. We aspire not only to introduce key subjects but also to stay at the forefront of industry trends, preparing students for success in a rapidly evolving technological landscape.",,
2494,Books and Vibes at SDSU,Recreational,,"-To connect people who love to read and have similar interests -We want to create a safe space for people to make new friends and express themselves",,
2495,Aztecs for Socialism,Academic Major Related,,"We look to create a safe and inviting space to members across all racial, ethnic, sexual, and gender identities for sound education, community building, and effective political organizing. Aiming to serve the students of SDSU and broader SD.","Alternating: Wednesday 5-7PM, Thursday 5-7PM",
2497,Black Psychology Student Organization,Academic Major Related,,The fundamental purpose of the organization is to bring awareness of the existence and power of Black Psychology to improve the lives of Black people specifically and the world generally.,TBD,Black Resource Center or Library
2501,BlacQspace,Cultural,,"The purpose of the organization is to foster support for and education on 2SLGBTQIA+ Black identity and culture. It is a space dedicated to fostering community, dialogue, and healing curated by and with the intention for Black Two Spirit, lesbian, gay, bisexual, transgender, questioning, and additional gender and sexual identities that fall under the 2SLGBTQIA+ umbrella.",Fridays 1:30 - 3:30 pm,Union 3 - Legacy Suite
2503,Creative Collective Magazine,Academic Major Related,https://www.instagram.com/creativecollective_sdsu/,"The Creative Collective Magazine seeks to recognize the artistic talents of undergraduate and graduate students.  We are dedicated to acknowledging the many artistic students here at SDSU. We expect to publish magazines by the end of the Fall and Spring semesters that contain students’ artworks. The Creative Collective Magazine accepts art submissions in the form of creative writing such as poetry and short stories as well as visual arts such as painting/multimedia, photography, sculptures, and short films, and sound media such as music and songs. Students do not need to be club members in order to submit their art. Our mission is to encourage SDSU students to express themselves through artistic avenues. We hope to represent and empower students from all majors with published magazines containing their valuable work.",Every other Friday at 2pm,
2504,Chaldean Assyrian Student Organization,Cultural,,"The goal of the Chaldean Assyrian Student Organization is to promote a lively, welcoming community that honors and conserves the rich cultural legacy of Assyrian and Chaldean customs. Our goal is to bring together Chaldean and Assyrian students and people who are interested in both cultures in a setting that values social engagement, academic achievement, and cultural awareness.",,
2507,Comedy Club,Recreational,,"A club that is dedicated to producing original comedy of any form including but not limited to sketch comedy, stand-up comedy, and improv.",,
2508,Black Campus Ministries,Religious Based,,"To promote the love and healing of Jesus Christ. In addition to catering to the needs of the black community and explore how biblical principles can be applied to the black community’s experiences. BCM will be a beacon of light, standing firmly on the foundation that is Jesus, serving as a safe space for all to come and worship, learn, and connect with one another and God.In addition to creating a space for black students to seek the relevance of God as they pursue justice and reconciliation both within and outside of the black community on the campus of San Diego State University (SDSU) by:  - creating an environment that is supportive, but challenging for students of African descent on the campus of San Diego State University  - organizing programs that enhance an individual’s spiritual growth, social support, and personal confidence  - exposing the students of African descent to role models that exemplify and glorify Christ in their everyday lives",Wednesday’s  (6pm-7:30pm),BRC Living Room
