ID,Name,Type,Website,Purpose,Meeting Day,Meeting Location
3,Afrikan Student Union,Cultural,http://asuatsdsu.weebly.com,The purpose of the Afrikan Student Union (ASU) is to develop a sensitive environment for the Afrikan Student at San Diego State University. A positive atmosphere will be obtained by organizing retention programs with goals of enhancing individual academic performance making campus resources available and to instill pride and self esteem through the study of Afrikan History and culture.,Wednesday 2:45 - 4:30 pm,Park Blvd Suite
7,Alpha Chi Omega Sorority,Social Sorority,http://alwaysalphachiomega.org,"The purpose of our organization is the philanthropic event held annually to raise money for Becky's House, a non-profit organization protecting and providing women who are dealing with domestic violence.  We also support and raise money throughout the year and participate in other fundraisers to support other organizations charities.",Mondays 7:30 PM,Alpha Chi Omega Chapter House
10,Alpha Epsilon Pi Fraternity,Social Fraternity,http://www.aepisd.com,"Our basic purpose is to provide the opportunity for a Jewish man to be able to join a Jewish organization whose purpose is not specifically religious, but rather social and cultural in nature.    Alpha Epsilon Pi is a Jewish fraternity, though non-discriminatory and open to all who are willing to espouse its purpose and values.",Sundays 7:00 PM,5717 Lindo Paseo
12,Alpha Kappa Psi Professional Business Fraternity,Academic Major Related,http://www.sdsuakpsi.org,"Alpha Kappa Psi is recognized as the premier developer of principled business leaders. Membership includes participation in social, community service, and funding events with a focus on professional development.",Thursday 7pm,TBD
14,Alpha Phi Gamma Sorority,Social Sorority,http://sdalphaphigamma.wixsite.com/sdaphig,"The purpose of Alpha Phi Gamma is to bring together all women of different nationalities through the bonds of friendship and sisterhood. Alpha Phi Gamma exist to provide service and Asian Awareness to the university and the surrounding community for the betterment of society. It promotes scholarship, and academic excellence, personal development and leadership.",Sunday 7pm,"Visionary Suite, Student Union"
15,Alpha Phi Omega,Service & Support,http://www.aposdsu.org,"Alpha Phi Omega is San Diego State University's premier, gender-inclusive community service organization which fosters personal and professional development under the principles of leadership, friendship, and service.",Every Monday at 7:00PM,
16,Alpha Phi Sorority,Social Sorority,http://www.alphaphisdsu.com,"The purpose of our orginization is to create strong bonds of sisterhood and commitment, as well as to hold ourselves to the highest standard. We strive to promote academic excellence and serve our community and our campus in a proactive and example setting way.",Mondays 7:00 PM,Alpha Phi Chapter House or On Campus Classroom
19,American Institute of Aeronautics & Astronautics (AIAA),Academic Major Related,http://aiaasdsu.com,"To advance the arts, sciences, and technology of aeronautics and astronautics, and to promote the professionalism of those engaged in these pursuits.",TBD,TBD
20,American Marketing Association (AMA),Academic Major Related,http://www.sdsuama.com,"The American Marketing Association chapter at San Diego State University connects students of all majors to real world industry-leading professionals. We host community networking events, social events, and personal brand building workshops. Our goal is to help our members best prepare for their future careers post college!",Tuesdays 5:00-6:00 pm,In Person
21,American Medical Student Association,Academic Major Related,http://sdsuamsa.weebly.com,"The American Medical Student Association is the oldest and largest independent association of physicians-in-training in the United States. AMSA SDSU is the pre-medical chapter at San Diego State University offering its members various opportunities within the pre-health community. Some of the opportunities includes but are not limited to volunteering with the local organizations, shadowing physicians, guest speaker panels, professional development workshops, medical school road trips, and much more. Through our organization, you will meet and potentially gain lifelong friends to accompany you through the long and arduous journey of medicine!",Wednesdays at 5:30 p.m. - 6:30 p.m.,Presidential suite (Floor 3)
23,American Society of Mechanical Engineers (ASME),Academic Major Related,http://sdsuasme.weebly.com/,"The stated purposes of American Society of Mechanical Engineers at San Diego State University are: 1.	to provide resources, plan events, and facilitate programs that encourage and prepare mechanical engineering (ME) students to participate in a.	academic studies, design projects, and research; b.	career planning and the pursuit of employment in the engineering industry;  c.	social activities and community development; 2.	to promote mechanical engineering on campus at SDSU and in the the San Diego community;  3.	to recognize outstanding contributions on behalf of students, staff, and faculty to the ME Department, the College of Engineering, and to the global engineering community.",Tuesday 12:00pm,Visionary Sweet
24,Andrés Bonifacio Samahan,Cultural,http://absamahan.org,"The organization shall be based on the beliefs of Andrés Bonifacio, who fought for **Filipino independence in the late 19th century, to support educational enrichment and advancement through preserving, and increasing the awareness of the Filipino and Filipino American cultures through organized leadership, academic learning, and political and community involvement.",Friday; 12:00PM,"Park Boulevard, Aztec Student Union"
26,"Alpha Kappa Alpha Sorority, Inc.",Social Sorority,,"Alpha Kappa Alpha’s mission is to cultivate and encourage high scholastic and ethical standards, to promote unity and friendship among college women, to study and help alleviate problems concerning girls and women in order to improve their social stature, to maintain a progressive interest in college life, and to be of “Service to All Mankind"".",Monday biweekly at 7:00pm,SDSU
28,"Arnold Air Society, John Burdette Binkley Squadron",Academic Major Related,https://sites.google.com/view/jbbdet075/home?authuser=0,"1.1. Definition of Mission. The Arnold Air Society (AAS) has adopted as its mission three interrelated objectives which enhance the Air Force Reserve Officer Training Corps (AFROTC) and United States Air Force Academy (USAFA) commissioning programs and project the USAF image on campus and in the community. 1.2. Objectives and Functions. 1.2.1. First: 1.2.1.1. Objective: create a more efficient relationship among Air Force officer candidates, in particular within the AFROTC. 1.2.1.2. Function: provides opportunities for greater interaction among collegiate level Air Force officer candidates and encourages increased communication with Air Force officers and leaders in national defense, government, and industry. 1.2.2. Second: 1.2.2.1. Objective: aid in the development of effective Air Force officers. 1.2.2.2. Function: provides expanded opportunities for Air Force officer candidates to exercise leadership, management, organizational, and public relations skills. 1.2.3. Third: 1.2.3.1. Objective: further the purpose, traditions, and concepts of the United States Air Force. 1.2.3.2. Function: provides opportunities for officer candidates to participate in campus and community service activities, demonstrating the close relationship between civilian and military institutions.",Saturday 1900 - 2300,ENS Flagpole
30,Asian Pacific Student Alliance (APSA),Cultural,http://www.apsasdsu.org,"The Asian Pacific Student Alliance (APSA) is a non-profit, culturally-based organization established to unite diverse students at San Diego State University. APSA endeavors to encourage its members to learn about and celebrate Asian American and Pacific Islander (AAPI) cultural identities, traditions and beliefs. Ultimately, the organization aims to inform and involve all members in issues that may affect their lives as AAPI individuals or the welfare of the AAPI community.",Tuesdays from 2:00pm to 3:00pm,Park Blvd
40,Alpha Omega Campus Ministry,Religious Based,https://www.aosdcampus.com,"Our mission is to glorify God by studying and living out the teachings of Jesus, abiding in his love, and sharing his grace. We aim to teach students how to follow Jesus through repentance, baptism, and perseverance.",Tuesdays and Friday's @ 7:30PM,On-campus
48,Best Buddies SDSU,Service & Support,https://www.facebook.com/SDSUBestBuddies/,The purpose of this organization is to enrich the lives of students at SDSU and students and adults with intellectual and developmental disabilities by providing opportunities for one-to-one friendships and leadership opportunities.,Wednesday 5:30-7:30,Park Boulevard
49,Beta Alpha Psi,Honor Society,https://sdsubap.com/,"Beta Alpha Psi (BAP) is a national honors scholastic and professional coed business organization. The primary objective of the fraternity is to encourage and give recognition to scholastic and professional excellence in the field of accounting, finance and information systems. This includes promoting the study and practice of business administration, providing opportunities for self-development, associating with members and practicing professionals, and encouraging a sense of ethical, social and public responsibility.",Wednesday 11:30am to 1:00 pm,Legacy Suite - Student Union
52,Black Student Science Organization,Academic Major Related,http://www.bsso.org,The purposes of this organization are to provide academic and social support to the African American students on campus and to provide outreach and service to the neighboring communities of the university.,Wednesdays at 4:00 pm,State Suite
54,Student Nurses Association,Academic Major Related,http://www.sdsusna.com/,"The mission of Student Nurses Association - San Diego State University (SNA-SDSU) is to foster nursing education, facilitate early unity among our future colleagues in nursing, and optimize the nursing student's exposure to the numerous specialties and pathways in the ever-changing field of nursing.",Mondays 4:00-6:00PM,Park Boulevard
55,Aztec Catholic,Religious Based,https://www.azteccatholic.com,"In response to what we have experienced in Christ, the San Diego State Catholic Newman Club is called to empower and challenge young adults to become the people God created them to be.  We strive to do this through events and programs that: nurture the spiritual growth of students, engage students in service to the wider community, spread the light of Christ throughout the campus, promote fellowship and supportive Christian relationships.",Sunday 10:45am-12:00pm,Catholic Newman Center
59,"Chi Epsilon, Civil Engineering Honor Society",Academic Major Related,http://xesdsu.weebly.com,"Dedicated to the purpose of maintaining and promoting the status of civil engineering as an ideal profession, Chi-Epsilon was organized to recognize the characteristics of the individual civil engineer deemed to be fundamental to the successful pursuit of an engineering career, and to aid in the development of those characteristics in the civil engineering student. Engineering, the application of scientific principles to the practical needs of society, is assuming a constantly increasing responsibility for the well-being of all people, and thus calling for competence of the highest order. This responsibility can be discharged only by a professional group whose members are possessed of a good basic technical ability, intelligence, moral integrity, and effective social poise in their relationship with the larger community of which they are part. To contribute to the improvement of the profession, Chi Epsilon fosters the development and exercise of sound traits of character and technical ability among civil engineers, and its members, by precept and example, toward an ever higher standard of professional service.",Tuesdays @ 11AM,Union 2 - Metzli
63,Chinese Students and Scholars Association,Cultural,,"Serve Chinese students and scholars to provide services that they need, try our best to make their studying experience in SDSU more convenient and enjoyable.","Friday, 2:00pm-4:00pm","Aztec Student Union - Legacy Suite, 372"
70,College Republicans at San Diego State University,Political,https://linktr.ee/SDSUCR,"College Republicans at SDSU promote and facilitate Republican activism at San Diego State University and within San Diego County.    College Republicans also actively participate in organizing with other like-minded organizations. We also act as a significant resource via our brand by networking in local, statewide, and national politics.","Tuesdays, 7:30p-8:30p","Pride Suite, Student Union"
73,Society of Communication and Leadership (SoCaL),Academic Major Related,,"This organization is dedicated to promoting academic growth through enhancing professional connections among School of Communication graduate students, alumni, faculty and staff. The Society of Communication and Leadership (SoCaL) fosters faculty/student relationships and provides a variety of programs, resources, and events designed to assist graduate students in their future endeavors.",Bimonthly general member meetings Wed 2:00-3:00pm,COMM 209
80,Delta Sigma Pi,Academic Major Related,http://www.dspsdsu.com,"Delta Sigma Pi is a professional fraternity organized to foster the study of business in universities; to encourage scholarship, social activity and the association of students for their mutual advancement by research and practice; to promote closer affiliation between the commercial world and students of commerce, and to further a higher standard of commercial ethics and culture and the civic and commercial welfare of the community.",Sunday @5:00PM,Student Union/Classroom Reservation
81,Delta Sigma Psi Sorority,Social Sorority,http://deltasigmapsi.org,"To foster a memorable experience of college life, promote academic achievement, social interactions, community service, leadership, and networking (family ties).",,
83,Delta Upsilon International Fraternity,Social Fraternity,http://dusdsu.com/,"To Build Better Men through a variety of leadership development opportunities, educational programs, and social settings based on the principles of culture, character, justice, and friendship.",Sundays 5:00 PM,Delta Upsilon House - 5540 Hardy Ave
85,Engineers Without Borders - SDSU (EWB-SDSU),Academic Major Related,http://ewbsdsu.weebly.com/,"The mission of EWB-USA is to partner with developing communities to improve their quality of life through the implementation of environmentally sustainable, equitable, and economical engineering projects. In the process of working to advance developing communities, EWB-USA promotes the development of globally aware and internationally responsible engineers, students, and professionals.",Weekly on Tuesday's at 2:00-3:00pm,Visonary Suite
86,Entrepreneur Society,Academic Major Related,http://www.entrepreneur.sdsu.edu,"The purpose of the Entrepreneur Society is to foster a vibrant culture of entrepreneurship on campus, empowering students to develop entrepreneurial mindsets and launch their own ventures.  WE ARE OPEN TO ALL MAJORS. YOU DO NOT NEED TO BE STUDYING BUSINESS.  We provide support for students creating their own businesses, from coming up with the ideas to making dreams a reality.   We also invite out great guest speakers -- from CEO's of firms that do several hundred million dollars in business, to recent graduates that are in start-ups, we have successful entrepreneurs & movers & shakers tell their story.",Wednesday at 6pm - 7pm (usually),EIS 103
88,EOP Student Advisory Board,Cultural,,"To support EOP students in their academic, social, civic, and cultural development. As well as direct them to resources that will allow them to be active, involved, and engaged during their time at San Diego State.",,SSE 2109/ Zoom
93,Finance & Investment Society of San Diego State University,Academic Major Related,http://sdsufis.com,"The Finance & Investment Society of San Diego State University is a professional student organization, which provides an opportunity for all majors to develop their professional competency. Our mission is to build a strong and growing relationship between the business community of Southern California and the members of the Finance & Investment Society. We provide a professional environment which introduces its members to various career opportunities within the finance industry, providing them the means of establishing a network of business contacts. Our organization incorporates four main areas of emphasis including professional development, social interaction, campus involvement, and a strong presence in the community. These areas are included into our program to strengthen business skills, as well as for personal enrichment.",,
94,Financial Planning Association,Academic Major Related,https://sites.google.com/view/sdsufpa/home,"The purpose of this organization is to provide students with networking and professional opportunities in the financial planning field through guest speakers, special events, scholarships and workshops.",Thursday 7-8:30pm,"Presidential Suite, in the Student Union"
98,Furniture Design Association at SDSU,Academic Major Related,,Our purpose is to promote and educate Furniture Designers and bring community awareness to our craft.,Third Wednesday of every month,202
101,Future Physical Therapists Organization (FPTO),Academic Major Related,https://futureptorg.wixsite.com/sdsufpto,"The purpose of this organization is to promote academic success, preparation for graduate school, professionalism, and growth in the fields of physical therapy, occupational therapy, and the general study of kinesiology.",Monday 12-1,Pride Suite
103,Gamma Phi Beta Sorority,Social Sorority,http://www.gammaphisdsu.com,"To foster a nurturing environment that provides women the opportunity to achieve their potential through lifelong commitment to intellectual growth, individual worth and service to humanity.",Mondays 7:00 PM,SDSU classroom
107,Gamma Zeta Alpha Fraternity,Social Fraternity,http://gammas.org,"The mission of Gamma Zeta Alpha Fraternity, Inc, a not-for-profit corporation built on the foundation of respect and brotherhood, is to establish and promote a nurturing environment at the university level and beyond, through academic excellence, community service, and the celebration of the diverse Latino Culture.",Monday 7:30pm,Presidential Suite
118,Hispanic Business Student Association (HBSA),Academic Major Related,,"HBSA seeks to promote the educational and professional careers of its members with an emphasis on the Hispanic population at San Diego State University. Members are encouraged to become future leaders in the professional world. Inspiring guest speakers from the public and private sector are invited to present at meetings and professional events. Companies, organizations and individuals are solicited to host workshops which are designed to address educational issues, business trends, and career opportunities relating to the Hispanic community.",Wednesdays 4:30-6:00 pm (Starting August 24th)),Legacy Suite
120,Weber Honors College Student Society,Honor Society,http://newscenter.sdsu.edu/dus/uhc/Default.aspx,"The purpose of this organization is to work to ensure that the Weber Honors College fulfills its mission statement and satisfies the expectations of honors students by acting as an advisory board to the Weber Honors College, as the representative body of its members. Through extra-curricular service and social activities, the Weber Honors College strives to create a community of students who take an interest in being responsible and engaged members of their university, greater community, and world.","Wednesdays, 12-1pm",AD 201
121,Lodging Management Student Association (LMSA),Academic Major Related,https://lmsasdsu.wixsite.com/lmsa,The purpose of this organization is to provide a platform to bridge education and the professional lodging industry.,Tuesdays at 6:30pm,Balboa Room
123,IEEE - Institute of Electrical and Electronics Engineers,Academic Major Related,http://ieee.sdsu.edu,"For the past 40 years, the IEEE (Institute of Electrical and Electronics Engineers) has been the primary contributor to the advancement of technology throughout the world. Creating and innovating to accelerate society and business, the IEEE continues to propel technology with over 430,000 members within 180 countries globally. The SDSU IEEE Student branch, like its parent organization, aims to push forth similar goals through: 	•	Bringing in professional guest speakers to gain insight into engineering careers 	•	Completing project to give student hands-on experience 	•	Assist student in tutoring and professional development 	•	Serving and working together with the IEEE parent branch 	•	Collaborating with SDSU faculty and the engineering student council","Tuesday, 2pm-3pm (weekly)",SDSU
124,Interfraternity Council (IFC),Greek Auxiliary Group,http://sdsuifc.net,"The purpose of the InterFraternity Council shall be to promote the best interests of the University, to assist and strengthen fraternities individually and collectively in the achievement of their worthy purposes, to provide a medium for the exercising of self-government and the self-regulation of fraternity affairs, to offer opportunities for the further development and expansion of fraternity life on campus, to act as liason between fraternities and the University administration, to offer a common meeting ground for all fraternities, and to foster fellowship and goodwill among the fraternities and the student body as a whole.",Weekly Tuesday 2:00 PM,Pierce Greek Life Center
125,International Business Society,Academic Major Related,http://www.sdsuibsociety.org,"""The International Business Society strives to provide students with educational and professional network oppurtunies, teach professional skills, and explore study abroad programs, international internships and business career opportunities.""",Thursdays from 5:30pm-7:30pm,2 - Metztli
126,International Student Association at SDSU,Cultural,https://www.instagram.com/isa.sdsu/,"The purpose of this organization shall be to promote cultural awareness, international goodwill, and to set up fun programs that benefit our diverse student community that has an interest in international issues.",1:00PM-2:00PM Monday,Virtual
127,International Youth and Students for Social Equality (IYSSE),Political,https://linktr.ee/iysse_sdsu,"The purposes of this organization are to build a movement of student youth in opposition to war and social inequality upon the foundation of international socialism. The International Youth and Students for Social Equality is a political organization, but its actions will not be limited to those of a strictly political nature. The overarching goal of the organization is to unite students on the basis of international socialist politics. This will involve meetings and discussions on historical, philosophical, and political issues, as well as active participation in the cultural and political life of the university.",Wednesdays at 7 P.M.,TBD
131,ISCOR Student Society,Academic Major Related,,"Foster a sense of community among ISCOR students, while providing a platform for networking, exploration  of professional opportunities, discussion of international issues, and service to the community and SDSU.",Tuesday 7-8pm,Visionary Suite
132,Japanese Student Association,Cultural,,"The Japanese Student Association of San Diego State University is dedicated to creating a better understanding of the Japanese culture among people of all backgrounds. JSA provides various career opportunities, events for social interaction, and memorable experiences for all students.","Wednesday, 3:00pm-4:00pm",Mata'yuum
133,Jewelry Student Co-op,Academic Major Related,,To serve as a creative collective focused on advancement of metalworking techniques and continuing the practice of instruction of old methods.,Tuesday 6:15-7:15,ART 402/404
138,"Kappa Alpha Psi Fraternity, Inc.",Social Fraternity,http://www.kappaalphapsi1911.com,The fundamental purpose of Kappa Alpha Psi is Achievement in every field of human endeavour.,Thursday,Student Union -
139,Kappa Alpha Theta Sorority,Social Sorority,https://www.sdsutheta.org/,The intellectual ambition of the Fraternity shall be the attainment of highest scholarship. The social aim of the Fraternity shall be to exercise the widest influence for good. The moral aim of the Fraternity shall be the standard of love.,Monday 7:00pm,
140,Kappa Delta,Social Sorority,http://sdsu.kappadelta.org/,"The purpose of Kappa Delta sorority is to promote true friendship among the college girls of our country by inculcating into their hearts and lives, those values, of truth, of honor, of duty, without which there can be no true friendship.",Monday 7:00 PM,SDSU campus
147,Lambda Sigma Gamma Sorority,Social Sorority,https://lsgatsdsu.weebly.com/,"The purposes of this organization are to instill the desire for self-improvement, scholastic excellence and the cultivation of civic responsibility.  Also, to promote unity and higher education.",Wednesdays at 7:30 pm,Union/ Presidential Suite
150,Latino Student Social Work Association,Academic Major Related,https://www.facebook.com/sdsu.lsswa,"The purpose of this organization is to educate, advocate for, and empower social work students, the social work profession, and the Latino community.",Every other Friday at 6-7PM,Metztli
